{
  "$schema": "./benchmark-baskets.v1.schema.json",
  "corpusVersion": "1.0.0",
  "createdAt": "2026-07-16",
  "description": "Twenty synthetic representative grocery baskets instantiated in each candidate launch region. They contain no personal data, address, coordinates, live prices, or expected store winners.",
  "privacy": {
    "synthetic": true,
    "containsPersonalData": false,
    "containsOrigin": false,
    "containsLiveProviderData": false
  },
  "defaultAssertions": {
    "completeBasketRequired": true,
    "maximumStores": 3,
    "integerOreRequired": true,
    "integerBaseUnitsRequired": true,
    "unknownMustRemainExplicit": true,
    "partialComparisonMustBeQualified": true
  },
  "scenarios": [
    {
      "id": "s01-everyday-basics",
      "name": "Everyday basics",
      "tags": ["small_basket", "package_rounding", "staples"],
      "acceptanceFocus": ["whole_packages", "ordinary_price_coverage", "complete_plan"],
      "items": [
        {"needId":"milk","query":"lettmelk","identity":{"kind":"exact-product","canonicalProductId":"product:benchmark:lettmelk-1l"},"requiredAmount":{"value":2,"unit":"package"},"matchMode":"constrained","constraints":[]},
        {"needId":"bread","query":"grovbrød","identity":{"kind":"reviewed-family","familyId":"family:benchmark:bread"},"requiredAmount":{"value":2,"unit":"piece"},"matchMode":"constrained","constraints":["wholegrain"]},
        {"needId":"eggs","query":"egg","identity":{"kind":"reviewed-family","familyId":"family:benchmark:eggs"},"requiredAmount":{"value":12,"unit":"piece"},"matchMode":"flexible","constraints":[]},
        {"needId":"butter","query":"smør","identity":{"kind":"reviewed-family","familyId":"family:benchmark:butter"},"requiredAmount":{"value":500,"unit":"g"},"matchMode":"flexible","constraints":[]}
      ]
    },
    {
      "id": "s02-breakfast",
      "name": "Breakfast restock",
      "tags": ["medium_basket", "staples", "fresh_produce"],
      "acceptanceFocus": ["mixed_units", "flexible_matching", "cross_chain_coverage"],
      "items": [
        {"needId":"oats","query":"havregryn","identity":{"kind":"reviewed-family","familyId":"family:benchmark:oats"},"requiredAmount":{"value":1000,"unit":"g"},"matchMode":"flexible","constraints":[]},
        {"needId":"yogurt","query":"naturell yoghurt","identity":{"kind":"reviewed-family","familyId":"family:benchmark:yogurt"},"requiredAmount":{"value":1000,"unit":"g"},"matchMode":"flexible","constraints":[]},
        {"needId":"bananas","query":"bananer","identity":{"kind":"reviewed-family","familyId":"family:benchmark:bananas"},"requiredAmount":{"value":1500,"unit":"g"},"matchMode":"flexible","constraints":[]},
        {"needId":"coffee","query":"filterkaffe","identity":{"kind":"reviewed-family","familyId":"family:benchmark:coffee"},"requiredAmount":{"value":500,"unit":"g"},"matchMode":"flexible","constraints":[]}
      ]
    },
    {
      "id": "s03-pasta-dinner",
      "name": "Pasta dinner",
      "tags": ["meal", "medium_basket", "quantity_fulfilment"],
      "acceptanceFocus": ["package_surplus", "substitution_explanation", "complete_plan"],
      "items": [
        {"needId":"pasta","query":"tørr pasta","identity":{"kind":"reviewed-family","familyId":"family:benchmark:pasta"},"requiredAmount":{"value":1000,"unit":"g"},"matchMode":"flexible","constraints":[]},
        {"needId":"minced-beef","query":"kjøttdeig storfe","identity":{"kind":"reviewed-family","familyId":"family:benchmark:minced-beef"},"requiredAmount":{"value":800,"unit":"g"},"matchMode":"constrained","constraints":["beef"]},
        {"needId":"tomatoes","query":"hakkede tomater","identity":{"kind":"reviewed-family","familyId":"family:benchmark:tomatoes"},"requiredAmount":{"value":800,"unit":"g"},"matchMode":"flexible","constraints":[]},
        {"needId":"onion","query":"gul løk","identity":{"kind":"reviewed-family","familyId":"family:benchmark:onion"},"requiredAmount":{"value":500,"unit":"g"},"matchMode":"flexible","constraints":[]},
        {"needId":"cheese","query":"fast gulost","identity":{"kind":"reviewed-family","familyId":"family:benchmark:cheese"},"requiredAmount":{"value":300,"unit":"g"},"matchMode":"flexible","constraints":[]}
      ]
    },
    {
      "id": "s04-taco-night",
      "name": "Taco night",
      "tags": ["meal", "multibuy_candidate", "many_packages"],
      "acceptanceFocus": ["multibuy_remainder", "package_count", "offer_conditions"],
      "items": [
        {"needId":"tortillas","query":"tortillalefser","identity":{"kind":"reviewed-family","familyId":"family:benchmark:tortillas"},"requiredAmount":{"value":16,"unit":"piece"},"matchMode":"flexible","constraints":[]},
        {"needId":"minced-meat","query":"kjøttdeig","identity":{"kind":"reviewed-family","familyId":"family:benchmark:minced-meat"},"requiredAmount":{"value":800,"unit":"g"},"matchMode":"flexible","constraints":[]},
        {"needId":"beans","query":"svarte bønner","identity":{"kind":"reviewed-family","familyId":"family:benchmark:beans"},"requiredAmount":{"value":400,"unit":"g"},"matchMode":"flexible","constraints":[]},
        {"needId":"salsa","query":"tacosaus salsa","identity":{"kind":"reviewed-family","familyId":"family:benchmark:salsa"},"requiredAmount":{"value":500,"unit":"g"},"matchMode":"flexible","constraints":[]},
        {"needId":"cheese","query":"revet ost","identity":{"kind":"reviewed-family","familyId":"family:benchmark:cheese"},"requiredAmount":{"value":300,"unit":"g"},"matchMode":"flexible","constraints":[]},
        {"needId":"lettuce","query":"isbergsalat","identity":{"kind":"reviewed-family","familyId":"family:benchmark:lettuce"},"requiredAmount":{"value":1,"unit":"piece"},"matchMode":"flexible","constraints":[]}
      ]
    },
    {
      "id": "s05-fish-dinner",
      "name": "Fish dinner",
      "tags": ["meal", "fresh_produce", "weight_based"],
      "acceptanceFocus": ["weight_units", "fresh_vs_frozen_substitution", "coverage_unknowns"],
      "items": [
        {"needId":"fish","query":"hvit fiskefilet","identity":{"kind":"reviewed-family","familyId":"family:benchmark:fish"},"requiredAmount":{"value":800,"unit":"g"},"matchMode":"constrained","constraints":["boneless"]},
        {"needId":"potatoes","query":"poteter","identity":{"kind":"reviewed-family","familyId":"family:benchmark:potatoes"},"requiredAmount":{"value":2000,"unit":"g"},"matchMode":"flexible","constraints":[]},
        {"needId":"carrots","query":"gulrøtter","identity":{"kind":"reviewed-family","familyId":"family:benchmark:carrots"},"requiredAmount":{"value":1000,"unit":"g"},"matchMode":"flexible","constraints":[]},
        {"needId":"broccoli","query":"brokkoli","identity":{"kind":"reviewed-family","familyId":"family:benchmark:broccoli"},"requiredAmount":{"value":500,"unit":"g"},"matchMode":"flexible","constraints":[]}
      ]
    },
    {
      "id": "s06-vegetarian-curry",
      "name": "Vegetarian curry",
      "tags": ["meal", "vegetarian", "pantry"],
      "acceptanceFocus": ["dietary_constraint", "package_surplus", "generic_family_matching"],
      "items": [
        {"needId":"chickpeas","query":"kikerter","identity":{"kind":"reviewed-family","familyId":"family:benchmark:chickpeas"},"requiredAmount":{"value":800,"unit":"g"},"matchMode":"constrained","constraints":["vegetarian"]},
        {"needId":"coconut-milk","query":"kokosmelk","identity":{"kind":"reviewed-family","familyId":"family:benchmark:coconut-milk"},"requiredAmount":{"value":800,"unit":"ml"},"matchMode":"flexible","constraints":[]},
        {"needId":"rice","query":"ris","identity":{"kind":"reviewed-family","familyId":"family:benchmark:rice"},"requiredAmount":{"value":1000,"unit":"g"},"matchMode":"flexible","constraints":[]},
        {"needId":"onion","query":"gul løk","identity":{"kind":"reviewed-family","familyId":"family:benchmark:onion"},"requiredAmount":{"value":500,"unit":"g"},"matchMode":"flexible","constraints":[]},
        {"needId":"spinach","query":"frossen spinat","identity":{"kind":"reviewed-family","familyId":"family:benchmark:spinach"},"requiredAmount":{"value":500,"unit":"g"},"matchMode":"constrained","constraints":["frozen"]}
      ]
    },
    {
      "id": "s07-packed-lunches",
      "name": "Packed lunches",
      "tags": ["medium_basket", "fresh_produce", "package_rounding"],
      "acceptanceFocus": ["quantity_fulfilment", "reviewed_families", "complete_plan"],
      "items": [
        {"needId":"bread","query":"grovbrød","identity":{"kind":"reviewed-family","familyId":"family:benchmark:bread"},"requiredAmount":{"value":2,"unit":"piece"},"matchMode":"constrained","constraints":["wholegrain"]},
        {"needId":"cheese","query":"skivet gulost","identity":{"kind":"reviewed-family","familyId":"family:benchmark:cheese"},"requiredAmount":{"value":500,"unit":"g"},"matchMode":"flexible","constraints":[]},
        {"needId":"ham","query":"kokt skinke pålegg","identity":{"kind":"reviewed-family","familyId":"family:benchmark:ham"},"requiredAmount":{"value":400,"unit":"g"},"matchMode":"constrained","constraints":["pork"]},
        {"needId":"cucumber","query":"agurk","identity":{"kind":"reviewed-family","familyId":"family:benchmark:cucumber"},"requiredAmount":{"value":2,"unit":"piece"},"matchMode":"flexible","constraints":[]},
        {"needId":"apples","query":"epler","identity":{"kind":"reviewed-family","familyId":"family:benchmark:apples"},"requiredAmount":{"value":1500,"unit":"g"},"matchMode":"flexible","constraints":[]}
      ]
    },
    {
      "id": "s08-household-cleaning",
      "name": "Household cleaning",
      "tags": ["non_food", "large_packages", "multibuy_candidate"],
      "acceptanceFocus": ["non_food_categories", "piece_and_volume_units", "offer_conditions"],
      "items": [
        {"needId":"dish-soap","query":"oppvaskmiddel","identity":{"kind":"exact-product","canonicalProductId":"product:benchmark:oppvaskmiddel-500ml"},"requiredAmount":{"value":2,"unit":"package"},"matchMode":"constrained","constraints":[]},